{
  "$schema": "l2_semantic_capabilities.schema.json",
  "aggregation": "A capability-attempt passes only when every semantic_probe assigned to the capability passes. Each complete capability contributes one unit; driver_cross_check and diagnostic probes never add denominator units.",
  "capabilities": [
    {
      "capability_id": "web.animations",
      "category": "animations",
      "description": "All semantic probes below are correlated evidence for this primary capability and jointly contribute one all-probes-pass verdict.",
      "observable": "dom_state",
      "probes": [
        {
          "claim": "Web Animations (Element.animate/getAnimations)",
          "role": "diagnostic",
          "task_id": "r3_fv_web_animations"
        }
      ],
      "title": "animations"
    },
    {
      "capability_id": "web.clipboard",
      "category": "clipboard",
      "description": "All semantic probes below are correlated evidence for this primary capability and jointly contribute one all-probes-pass verdict.",
      "observable": "dom_state",
      "probes": [
        {
          "claim": "Clipboard API",
          "role": "diagnostic",
          "task_id": "r3_fv_clipboard_api"
        }
      ],
      "title": "clipboard"
    },
    {
      "capability_id": "web.components.custom_elements",
      "category": "components",
      "description": "All semantic probes below are correlated evidence for this primary capability and jointly contribute one all-probes-pass verdict.",
      "observable": "dom_state",
      "probes": [
        {
          "claim": "customElements.define + upgrade",
          "role": "diagnostic",
          "task_id": "r3_probe_c5_customelements"
        },
        {
          "claim": "customElements.define + upgrade",
          "role": "semantic_probe",
          "task_id": "v2_leg_probe_c5_customelements"
        }
      ],
      "title": "components / custom elements"
    },
    {
      "capability_id": "web.crypto.aes_gcm",
      "category": "crypto",
      "description": "All semantic probes below are correlated evidence for this primary capability and jointly contribute one all-probes-pass verdict.",
      "observable": "dom_state",
      "probes": [
        {
          "claim": "AES-GCM encrypt/decrypt roundtrip",
          "role": "semantic_probe",
          "task_id": "v2_wpt_crypto_aesgcm_roundtrip"
        }
      ],
      "title": "crypto / aes gcm"
    },
    {
      "capability_id": "web.crypto.digest",
      "category": "crypto",
      "description": "All semantic probes below are correlated evidence for this primary capability and jointly contribute one all-probes-pass verdict.",
      "observable": "dom_state",
      "probes": [
        {
          "claim": "SubtleCrypto SHA-256 digest byteLength is 32",
          "role": "semantic_probe",
          "task_id": "v2_wpt_crypto_digest_bytelength"
        },
        {
          "claim": "SubtleCrypto SHA-1 of 'abc'",
          "role": "semantic_probe",
          "task_id": "v2_wpt_crypto_sha1_abc"
        },
        {
          "claim": "SubtleCrypto SHA-256 of 'abc'",
          "role": "semantic_probe",
          "task_id": "v2_wpt_crypto_sha256_abc"
        },
        {
          "claim": "SubtleCrypto SHA-256 of empty input",
          "role": "semantic_probe",
          "task_id": "v2_wpt_crypto_sha256_empty"
        },
        {
          "claim": "SubtleCrypto SHA-384 of 'abc'",
          "role": "semantic_probe",
          "task_id": "v2_wpt_crypto_sha384_abc"
        },
        {
          "claim": "SubtleCrypto SHA-512 of 'abc'",
          "role": "semantic_probe",
          "task_id": "v2_wpt_crypto_sha512_abc"
        }
      ],
      "title": "crypto / digest"
    },
    {
      "capability_id": "web.crypto.get_random_values",
      "category": "crypto",
      "description": "All semantic probes below are correlated evidence for this primary capability and jointly contribute one all-probes-pass verdict.",
      "observable": "dom_state",
      "probes": [
        {
          "claim": "getRandomValues fills and returns same typed array",
          "role": "semantic_probe",
          "task_id": "v2_wpt_crypto_getrandomvalues_shape"
        }
      ],
      "title": "crypto / get random values"
    },
    {
      "capability_id": "web.crypto.hmac",
      "category": "crypto",
      "description": "All semantic probes below are correlated evidence for this primary capability and jointly contribute one all-probes-pass verdict.",
      "observable": "dom_state",
      "probes": [
        {
          "claim": "HMAC-SHA256 sign then verify roundtrip",
          "role": "semantic_probe",
          "task_id": "v2_wpt_crypto_hmac_roundtrip"
        },
        {
          "claim": "HMAC-SHA256 verify rejects tampered mac",
          "role": "semantic_probe",
          "task_id": "v2_wpt_crypto_hmac_tamper"
        }
      ],
      "title": "crypto / hmac"
    },
    {
      "capability_id": "web.crypto.random_uuid",
      "category": "crypto",
      "description": "All semantic probes below are correlated evidence for this primary capability and jointly contribute one all-probes-pass verdict.",
      "observable": "dom_state",
      "probes": [
        {
          "claim": "crypto.randomUUID",
          "role": "diagnostic",
          "task_id": "r3_probe_c14_crypto_uuid"
        },
        {
          "claim": "crypto.randomUUID",
          "role": "semantic_probe",
          "task_id": "v2_leg_probe_c14_crypto_uuid"
        }
      ],
      "title": "crypto / random uuid"
    },
    {
      "capability_id": "web.css.cascade_specificity",
      "category": "css",
      "description": "All semantic probes below are correlated evidence for this primary capability and jointly contribute one all-probes-pass verdict.",
      "observable": "dom_state",
      "probes": [
        {
          "claim": "cascade !important overrides higher specificity",
          "role": "semantic_probe",
          "task_id": "v2_wpt_css_cascade_important"
        }
      ],
      "title": "css / cascade specificity"
    },
    {
      "capability_id": "web.css.computed_style_cascade",
      "category": "css",
      "description": "All semantic probes below are correlated evidence for this primary capability and jointly contribute one all-probes-pass verdict.",
      "observable": "dom_state",
      "probes": [
        {
          "claim": "getComputedStyle:color cascade",
          "role": "semantic_probe",
          "task_id": "r3_dA_e_color_gate"
        },
        {
          "claim": "getComputedStyle:font-size cascade",
          "role": "semantic_probe",
          "task_id": "r3_dA_e_fontsize_gate"
        },
        {
          "claim": "per-row getComputedStyle:color filtering + aggregate",
          "role": "semantic_probe",
          "task_id": "r3_dA_h_color_table"
        },
        {
          "claim": "computed color + font-size combined per-row classify",
          "role": "semantic_probe",
          "task_id": "r3_dA_h_priced_list"
        },
        {
          "claim": "getComputedStyle:background-color after class toggle",
          "role": "semantic_probe",
          "task_id": "r3_dA_m_bgcolor_toggle"
        },
        {
          "claim": "Computed-style stock filtering",
          "role": "semantic_probe",
          "task_id": "r4_q01_stock_list"
        },
        {
          "claim": "Computed-style status dashboard",
          "role": "semantic_probe",
          "task_id": "r4_q04_status_dashboard"
        }
      ],
      "title": "css / computed style cascade"
    },
    {
      "capability_id": "web.css.constructable_stylesheets",
      "category": "css",
      "description": "All semantic probes below are correlated evidence for this primary capability and jointly contribute one all-probes-pass verdict.",
      "observable": "dom_state",
      "probes": [
        {
          "claim": "adoptedStyleSheets constructable stylesheet",
          "role": "semantic_probe",
          "task_id": "r3_dC_e_adopted_color"
        },
        {
          "claim": "adoptedStyleSheets applied after async",
          "role": "semantic_probe",
          "task_id": "r3_dC_m_adopted_async"
        },
        {
          "claim": "adoptedStyleSheets widget state",
          "role": "semantic_probe",
          "task_id": "r4_q09_widget_adopted"
        },
        {
          "claim": "constructable stylesheet + shadow adoptedStyleSheets",
          "role": "semantic_probe",
          "task_id": "v2_wpt_css_constructable"
        }
      ],
      "title": "css / constructable stylesheets"
    },
    {
      "capability_id": "web.css.cssom_rules",
      "category": "css",
      "description": "All semantic probes below are correlated evidence for this primary capability and jointly contribute one all-probes-pass verdict.",
      "observable": "dom_state",
      "probes": [
        {
          "claim": "CSSOM styleSheets[].cssRules enumeration",
          "role": "diagnostic",
          "task_id": "r3_probe_c6_cssom_rules"
        },
        {
          "claim": "CSSOM styleSheets[].cssRules enumeration",
          "role": "semantic_probe",
          "task_id": "v2_leg_probe_c6_cssom_rules"
        }
      ],
      "title": "css / cssom rules"
    },
    {
      "capability_id": "web.css.custom_properties",
      "category": "css",
      "description": "All semantic probes below are correlated evidence for this primary capability and jointly contribute one all-probes-pass verdict.",
      "observable": "dom_state",
      "probes": [
        {
          "claim": "nested var() cascade override + async",
          "role": "semantic_probe",
          "task_id": "r3_dA_h_var_cascade"
        },
        {
          "claim": "CSS var() resolution after theme class swap",
          "role": "semantic_probe",
          "task_id": "r3_dA_m_var_theme"
        },
        {
          "claim": "CSS-variable pricing summary",